"MatchingRule","Record1Identifier","Record2Identifier","TotalSimilarity","IsMatch","[0] GameTitleComparatorLevenshtein record1Value","[0] GameTitleComparatorLevenshtein record2Value","[0] GameTitleComparatorLevenshtein record1PreprocessedValue","[0] GameTitleComparatorLevenshtein record2PreprocessedValue","[0] GameTitleComparatorLevenshtein similarity","[0] GameTitleComparatorLevenshtein postproccesedSimilarity"
"LinearCombinationMatchingRule","Games_Updated_ID_7809","vgsales_ID_5449","0.31999999999999995",,"The Sims: Hot Date","The King of Fighters XIII","The Sims: Hot Date","The King of Fighters XIII","0.31999999999999995","0.31999999999999995"
"LinearCombinationMatchingRule","Games_Updated_ID_13796","vgsales_ID_14945","0.18518518518518523",,"Beatdown","BeatMania IIDX 11: IIDX Red","Beatdown","BeatMania IIDX 11: IIDX Red","0.18518518518518523","0.18518518518518523"
"LinearCombinationMatchingRule","Games_Updated_ID_11944","vgsales_ID_9198","0.24489795918367352",,"The Worst Case Scenario Survival Trivia Challenge","The Walking Dead: Season Two","The Worst Case Scenario Survival Trivia Challenge","The Walking Dead: Season Two","0.24489795918367352","0.24489795918367352"
"LinearCombinationMatchingRule","Games_Updated_ID_6620","vgsales_ID_2022","0.13580246913580252",,"The Lord of the Rings, The Battle for Middle-earth II, The Rise of the Witch-King","The Simpsons Game","The Lord of the Rings, The Battle for Middle-earth II, The Rise of the Witch-King","The Simpsons Game","0.13580246913580252","0.13580246913580252"
"LinearCombinationMatchingRule","Games_Updated_ID_3563","vgsales_ID_11484","0.26086956521739135",,"Tom Clancy's HAWX 2","Tomb Raider: Underworld","Tom Clancy's HAWX 2","Tomb Raider: Underworld","0.26086956521739135","0.26086956521739135"
"LinearCombinationMatchingRule","Games_Updated_ID_14607","vgsales_ID_2976","0.375",,"Star Wars Rebellion","Star Wars: Masters of Teras Kasi","Star Wars Rebellion","Star Wars: Masters of Teras Kasi","0.375","0.375"
"LinearCombinationMatchingRule","Games_Updated_ID_13663","vgsales_ID_9161","0.37142857142857144",,"The Elk Moon Murder","The Operative: No One Lives Forever","The Elk Moon Murder","The Operative: No One Lives Forever","0.37142857142857144","0.37142857142857144"
"LinearCombinationMatchingRule","Games_Updated_ID_5413","vgsales_ID_1018","0.36363636363636365",,"The Golden Compass","The Beatles: Rock Band","The Golden Compass","The Beatles: Rock Band","0.36363636363636365","0.36363636363636365"
"LinearCombinationMatchingRule","Games_Updated_ID_12653","vgsales_ID_14133","0.16666666666666663",,"The Rise and Rule of Ancient Empires","The Void","The Rise and Rule of Ancient Empires","The Void","0.16666666666666663","0.16666666666666663"
"LinearCombinationMatchingRule","Games_Updated_ID_13705","vgsales_ID_7054","0.375",,"Deadlock","Deadly Creatures","Deadlock","Deadly Creatures","0.375","0.375"
"LinearCombinationMatchingRule","Games_Updated_ID_3438","vgsales_ID_6566","0.1875",,"Kinect Sports","King of Fighters: Maximum Impact","Kinect Sports","King of Fighters: Maximum Impact","0.1875","0.1875"
"LinearCombinationMatchingRule","Games_Updated_ID_9248","vgsales_ID_8755","1.0",,"Digimon World 4","Digimon World 4","Digimon World 4","Digimon World 4","1.0","1.0"
"LinearCombinationMatchingRule","Games_Updated_ID_7121","vgsales_ID_10640","0.2075471698113207",,"The Lord of the Rings, The Battle for Middle-earth II","The History Channel: Civil War - Secret Missions","The Lord of the Rings, The Battle for Middle-earth II","The History Channel: Civil War - Secret Missions","0.2075471698113207","0.2075471698113207"
"LinearCombinationMatchingRule","Games_Updated_ID_4648","vgsales_ID_7575","0.3076923076923077",,"The Lord of the Rings: Conquest","The Fairly Odd Parents: Shadow Showdown","The Lord of the Rings: Conquest","The Fairly Odd Parents: Shadow Showdown","0.3076923076923077","0.3076923076923077"
"LinearCombinationMatchingRule","Games_Updated_ID_3467","vgsales_ID_552","0.15384615384615385",,"The Sims 3","The Legend of Zelda: A Link to the Past","The Sims 3","The Legend of Zelda: A Link to the Past","0.15384615384615385","0.15384615384615385"
"LinearCombinationMatchingRule","Games_Updated_ID_3715","vgsales_ID_3228","0.6111111111111112",,"Tiger Woods PGA Tour 11","Tiger Woods PGA Tour 12: The Masters","Tiger Woods PGA Tour 11","Tiger Woods PGA Tour 12: The Masters","0.6111111111111112","0.6111111111111112"
"LinearCombinationMatchingRule","Games_Updated_ID_9728","vgsales_ID_1905","0.3076923076923077",,"The Urbz: Sims in the City","The Orange Box","The Urbz: Sims in the City","The Orange Box","0.3076923076923077","0.3076923076923077"
"LinearCombinationMatchingRule","Games_Updated_ID_12768","vgsales_ID_6071","0.33333333333333337",,"Dragon Force 2 (Import)","Dragon Ball Heroes: Ultimate Mission","Dragon Force 2 (Import)","Dragon Ball Heroes: Ultimate Mission","0.33333333333333337","0.33333333333333337"
"LinearCombinationMatchingRule","Games_Updated_ID_11335","vgsales_ID_9682","0.19999999999999996",,"World Series Baseball 2K3","Worms 3D","World Series Baseball 2K3","Worms 3D","0.19999999999999996","0.19999999999999996"
"LinearCombinationMatchingRule","Games_Updated_ID_10960","vgsales_ID_8138","0.36111111111111116",,"Command & Conquer Generals Zero Hour","Commandos 2: Men of Courage","Command & Conquer Generals Zero Hour","Commandos 2: Men of Courage","0.36111111111111116","0.36111111111111116"
"LinearCombinationMatchingRule","Games_Updated_ID_5322","vgsales_ID_7075","0.09677419354838712",,"The Club","The Idolm@ster SP: Wandering Star / Perfect Sun / Missing Moon","The Club","The Idolm@ster SP: Wandering Star / Perfect Sun / Missing Moon","0.09677419354838712","0.09677419354838712"
"LinearCombinationMatchingRule","Games_Updated_ID_14712","vgsales_ID_9926","0.22857142857142854",,"Theme Hospital","The Walking Dead: Survival Instinct","Theme Hospital","The Walking Dead: Survival Instinct","0.22857142857142854","0.22857142857142854"
"LinearCombinationMatchingRule","Games_Updated_ID_4247","vgsales_ID_1250","0.36363636363636365",,"The Beatles: Rock Band","The Simpsons Game","The Beatles: Rock Band","The Simpsons Game","0.36363636363636365","0.36363636363636365"
"LinearCombinationMatchingRule","Games_Updated_ID_757","vgsales_ID_3564","0.29032258064516125",,"The Disney Afternoon Collection","The Incredible Hulk","The Disney Afternoon Collection","The Incredible Hulk","0.29032258064516125","0.29032258064516125"
"LinearCombinationMatchingRule","Games_Updated_ID_13004","vgsales_ID_2518","0.36363636363636365",,"MediEvil","MediEvil: Resurrection","MediEvil","MediEvil: Resurrection","0.36363636363636365","0.36363636363636365"
"LinearCombinationMatchingRule","Games_Updated_ID_2801","vgsales_ID_3725","0.23880597014925375",,"Dragon Ball Z: Ultimate Tenkaichi","Dragon Quest Characters: Torneko no Daibouken 3: Fushigi no Dungeon","Dragon Ball Z: Ultimate Tenkaichi","Dragon Quest Characters: Torneko no Daibouken 3: Fushigi no Dungeon","0.23880597014925375","0.23880597014925375"
"LinearCombinationMatchingRule","Games_Updated_ID_9120","vgsales_ID_10079","0.45833333333333337",,"The Sims 2 Nightlife","The King of Fighters XII","The Sims 2 Nightlife","The King of Fighters XII","0.45833333333333337","0.45833333333333337"
"LinearCombinationMatchingRule","Games_Updated_ID_13276","vgsales_ID_8400","0.33333333333333337",,"Surface Tension","Surf's Up","Surface Tension","Surf's Up","0.33333333333333337","0.33333333333333337"
"LinearCombinationMatchingRule","Games_Updated_ID_6224","vgsales_ID_6474","0.4375",,"Virtua Fighter 2","Virtua Racing","Virtua Fighter 2","Virtua Racing","0.4375","0.4375"
"LinearCombinationMatchingRule","Games_Updated_ID_5554","vgsales_ID_11750","0.2941176470588235",,"Supreme Commander: Forged Alliance","Super Baseball","Supreme Commander: Forged Alliance","Super Baseball","0.2941176470588235","0.2941176470588235"
"LinearCombinationMatchingRule","Games_Updated_ID_96","vgsales_ID_11901","0.31818181818181823",,"The Last Of Us Part 2 Spoiler  - Dog Eat Dog","The King of Fighters: Evolution","The Last Of Us Part 2 Spoiler  - Dog Eat Dog","The King of Fighters: Evolution","0.31818181818181823","0.31818181818181823"
"LinearCombinationMatchingRule","Games_Updated_ID_681","vgsales_ID_837","0.9230769230769231",,"Madden NFL 18","Madden NFL 15","Madden NFL 18","Madden NFL 15","0.9230769230769231","0.9230769230769231"
"LinearCombinationMatchingRule","Games_Updated_ID_5322","vgsales_ID_9494","0.23809523809523814",,"The Club","The House of the Dead","The Club","The House of the Dead","0.23809523809523814","0.23809523809523814"
"LinearCombinationMatchingRule","Games_Updated_ID_7656","vgsales_ID_2762","0.28125",,"The Adventures of Cookie & Cream","The Walking Dead: Season One","The Adventures of Cookie & Cream","The Walking Dead: Season One","0.28125","0.28125"
"LinearCombinationMatchingRule","Games_Updated_ID_719","vgsales_ID_4733","0.24242424242424243",,"The Walking Dead: A New Frontier - Episode Five: Under the Gallows","The LEGO Movie Videogame","The Walking Dead: A New Frontier - Episode Five: Under the Gallows","The LEGO Movie Videogame","0.24242424242424243","0.24242424242424243"
"LinearCombinationMatchingRule","Games_Updated_ID_5904","vgsales_ID_2727","0.2195121951219512",,"Harry Potter and the Order of the Phoenix","Harvest Moon: Animal Parade","Harry Potter and the Order of the Phoenix","Harvest Moon: Animal Parade","0.2195121951219512","0.2195121951219512"
"LinearCombinationMatchingRule","Games_Updated_ID_2274","vgsales_ID_5329","0.2777777777777778",,"Karateka","Karaoke Revolution","Karateka","Karaoke Revolution","0.2777777777777778","0.2777777777777778"
"LinearCombinationMatchingRule","Games_Updated_ID_719","vgsales_ID_4732","0.24242424242424243",,"The Walking Dead: A New Frontier - Episode Five: Under the Gallows","The Terminator: Dawn of Fate","The Walking Dead: A New Frontier - Episode Five: Under the Gallows","The Terminator: Dawn of Fate","0.24242424242424243","0.24242424242424243"
"LinearCombinationMatchingRule","Games_Updated_ID_9108","vgsales_ID_12477","0.30434782608695654",,"Battalion Wars","Batman: Rise of Sin Tzu","Battalion Wars","Batman: Rise of Sin Tzu","0.30434782608695654","0.30434782608695654"
"LinearCombinationMatchingRule","Games_Updated_ID_8674","vgsales_ID_15207","0.16981132075471694",,"The Apprentice","The Lord of the Rings: The Battle for Middle-Earth II","The Apprentice","The Lord of the Rings: The Battle for Middle-Earth II","0.16981132075471694","0.16981132075471694"
"LinearCombinationMatchingRule","Games_Updated_ID_11924","vgsales_ID_4236","0.3157894736842105",,"Crazy Taxi 3","Crash of the Titans","Crazy Taxi 3","Crash of the Titans","0.3157894736842105","0.3157894736842105"
"LinearCombinationMatchingRule","Games_Updated_ID_11441","vgsales_ID_9793","0.29166666666666663",,"The Mystery of the Mummy","The King of Fighters Collection: The Orochi Saga","The Mystery of the Mummy","The King of Fighters Collection: The Orochi Saga","0.29166666666666663","0.29166666666666663"
"LinearCombinationMatchingRule","Games_Updated_ID_7382","vgsales_ID_4886","0.5",,"NHL 2001","NHL 99","NHL 2001","NHL 99","0.5","0.5"
"LinearCombinationMatchingRule","Games_Updated_ID_820","vgsales_ID_9526","0.19999999999999996",,"The Walking Dead: The Telltale Series - A New Frontier Ep. 2: Ties That Bind Part Two","The Price is Right 2010 Edition","The Walking Dead: The Telltale Series - A New Frontier Ep. 2: Ties That Bind Part Two","The Price is Right 2010 Edition","0.19999999999999996","0.19999999999999996"
"LinearCombinationMatchingRule","Games_Updated_ID_12125","vgsales_ID_2199","0.23913043478260865",,"The Incredible Machine: Even More Contraptions","The SpongeBob SquarePants Movie","The Incredible Machine: Even More Contraptions","The SpongeBob SquarePants Movie","0.23913043478260865","0.23913043478260865"
"LinearCombinationMatchingRule","Games_Updated_ID_6052","vgsales_ID_1358","0.2571428571428571",,"The New York Times Crosswords","The Legend of Zelda: The Minish Cap","The New York Times Crosswords","The Legend of Zelda: The Minish Cap","0.2571428571428571","0.2571428571428571"
"LinearCombinationMatchingRule","Games_Updated_ID_10561","vgsales_ID_5489","0.31999999999999995",,"Sonic Heroes","Sonic Boom: Rise of Lyric","Sonic Heroes","Sonic Boom: Rise of Lyric","0.31999999999999995","0.31999999999999995"
"LinearCombinationMatchingRule","Games_Updated_ID_9921","vgsales_ID_13157","0.2978723404255319",,"The Dukes of Hazzard: Return of the General Lee","The History Channel: Great Battles - Medieval","The Dukes of Hazzard: Return of the General Lee","The History Channel: Great Battles - Medieval","0.2978723404255319","0.2978723404255319"
"LinearCombinationMatchingRule","Games_Updated_ID_11043","vgsales_ID_825","0.31707317073170727",,"Pokmon Pinball: Ruby & Sapphire","Pokmon Mystery Dungeon: Blue Rescue Team","Pokmon Pinball: Ruby & Sapphire","Pokmon Mystery Dungeon: Blue Rescue Team","0.31707317073170727","0.31707317073170727"
"LinearCombinationMatchingRule","Games_Updated_ID_1352","vgsales_ID_10892","0.38888888888888884",,"The Order: 1886","The Crew: Wild Run","The Order: 1886","The Crew: Wild Run","0.38888888888888884","0.38888888888888884"
"LinearCombinationMatchingRule","Games_Updated_ID_12329","vgsales_ID_958","0.2666666666666667",,"The Mummy","The Evil Within","The Mummy","The Evil Within","0.2666666666666667","0.2666666666666667"
"LinearCombinationMatchingRule","Games_Updated_ID_14381","vgsales_ID_1253","0.26086956521739135",,"Resident Evil: Survivor","Resistance 3","Resident Evil: Survivor","Resistance 3","0.26086956521739135","0.26086956521739135"
"LinearCombinationMatchingRule","Games_Updated_ID_14713","vgsales_ID_9086","0.5714285714285714",,"Doom 64","Doom","Doom 64","Doom","0.5714285714285714","0.5714285714285714"
"LinearCombinationMatchingRule","Games_Updated_ID_2223","vgsales_ID_14938","0.1842105263157895",,"The Bridge","The Idolmaster: Gravure For You! Vol.7","The Bridge","The Idolmaster: Gravure For You! Vol.7","0.1842105263157895","0.1842105263157895"
"LinearCombinationMatchingRule","Games_Updated_ID_12992","vgsales_ID_9659","0.47619047619047616",,"Monster Rancher","Monster Truck Madness","Monster Rancher","Monster Truck Madness","0.47619047619047616","0.47619047619047616"
"LinearCombinationMatchingRule","Games_Updated_ID_12867","vgsales_ID_3633","0.3125",,"South Park Rally","Soul Reaver 2","South Park Rally","Soul Reaver 2","0.3125","0.3125"
"LinearCombinationMatchingRule","Games_Updated_ID_8324","vgsales_ID_3228","0.5555555555555556",,"Tiger Woods PGA Tour","Tiger Woods PGA Tour 12: The Masters","Tiger Woods PGA Tour","Tiger Woods PGA Tour 12: The Masters","0.5555555555555556","0.5555555555555556"
"LinearCombinationMatchingRule","Games_Updated_ID_6185","vgsales_ID_1205","0.19444444444444442",,"Ninja Gaiden","Ni no Kuni: Wrath of the White Witch","Ninja Gaiden","Ni no Kuni: Wrath of the White Witch","0.19444444444444442","0.19444444444444442"
"LinearCombinationMatchingRule","Games_Updated_ID_7875","vgsales_ID_5494","0.36363636363636365",,"Extreme-G 3","Extra Bases","Extreme-G 3","Extra Bases","0.36363636363636365","0.36363636363636365"
"LinearCombinationMatchingRule","Games_Updated_ID_4023","vgsales_ID_11634","0.2692307692307693",,"WWE Smackdown vs. Raw 2010","WWE Crush Hour","WWE Smackdown vs. Raw 2010","WWE Crush Hour","0.2692307692307693","0.2692307692307693"
"LinearCombinationMatchingRule","Games_Updated_ID_12443","vgsales_ID_11641","0.3142857142857143",,"Dragon Warrior I&II","Dragon Slayer: The Legend of Heroes","Dragon Warrior I&II","Dragon Slayer: The Legend of Heroes","0.3142857142857143","0.3142857142857143"
"LinearCombinationMatchingRule","Games_Updated_ID_587","vgsales_ID_11300","0.18604651162790697",,"The Inpatient","The Secret Saturdays: Beasts of the 5th Sun","The Inpatient","The Secret Saturdays: Beasts of the 5th Sun","0.18604651162790697","0.18604651162790697"
"LinearCombinationMatchingRule","Games_Updated_ID_13625","vgsales_ID_848","0.2727272727272727",,"FireTeam","Fire Emblem: Awakening","FireTeam","Fire Emblem: Awakening","0.2727272727272727","0.2727272727272727"
"LinearCombinationMatchingRule","Games_Updated_ID_11397","vgsales_ID_8247","0.2777777777777778",,"The Terminator: Dawn of Fate","The Grim Adventures of Billy & Mandy","The Terminator: Dawn of Fate","The Grim Adventures of Billy & Mandy","0.2777777777777778","0.2777777777777778"
"LinearCombinationMatchingRule","Games_Updated_ID_5141","vgsales_ID_6548","0.2558139534883721",,"Lego Indiana Jones: The Original Adventures","Legaia 2: Duel Saga","Lego Indiana Jones: The Original Adventures","Legaia 2: Duel Saga","0.2558139534883721","0.2558139534883721"
"LinearCombinationMatchingRule","Games_Updated_ID_5094","vgsales_ID_5283","0.20833333333333337",,"Battlefield: Bad Company","Batman: Rise of Sin Tzu","Battlefield: Bad Company","Batman: Rise of Sin Tzu","0.20833333333333337","0.20833333333333337"
"LinearCombinationMatchingRule","Games_Updated_ID_6763","vgsales_ID_3130","0.3055555555555556",,"The Legend of Spyro: A New Beginning","The Black Eyed Peas Experience","The Legend of Spyro: A New Beginning","The Black Eyed Peas Experience","0.3055555555555556","0.3055555555555556"
"LinearCombinationMatchingRule","Games_Updated_ID_5106","vgsales_ID_7957","0.20588235294117652",,"The Incredible Hulk","The Scorpion King: Sword of Osiris","The Incredible Hulk","The Scorpion King: Sword of Osiris","0.20588235294117652","0.20588235294117652"
"LinearCombinationMatchingRule","Games_Updated_ID_7443","vgsales_ID_11081","0.2222222222222222",,"Pac-Man: Adventures in Time","Pachitte Chonmage Tatsujin 10: Pachinko Fuyu no Sonata","Pac-Man: Adventures in Time","Pachitte Chonmage Tatsujin 10: Pachinko Fuyu no Sonata","0.2222222222222222","0.2222222222222222"
"LinearCombinationMatchingRule","Games_Updated_ID_6681","vgsales_ID_11217","0.23076923076923073",,"The Sims 2: Pets","The Incredibles: Rise of the Underminer","The Sims 2: Pets","The Incredibles: Rise of the Underminer","0.23076923076923073","0.23076923076923073"
"LinearCombinationMatchingRule","Games_Updated_ID_10653","vgsales_ID_8922","0.6571428571428571",,"Prince of Persia: The Sands of Time","Prince of Persia: The Two Thrones","Prince of Persia: The Sands of Time","Prince of Persia: The Two Thrones","0.6571428571428571","0.6571428571428571"
"LinearCombinationMatchingRule","Games_Updated_ID_6156","vgsales_ID_6141","0.7142857142857143",,"Pirates of the Caribbean: At World's End","Pirates of the Caribbean: Dead Man's Chest","Pirates of the Caribbean: At World's End","Pirates of the Caribbean: Dead Man's Chest","0.7142857142857143","0.7142857142857143"
"LinearCombinationMatchingRule","Games_Updated_ID_6767","vgsales_ID_12766","0.25",,"The Legend of Spyro: A New Beginning","The Lost Chronicles of Zerzura","The Legend of Spyro: A New Beginning","The Lost Chronicles of Zerzura","0.25","0.25"
"LinearCombinationMatchingRule","Games_Updated_ID_617","vgsales_ID_9578","0.24137931034482762",,"Rocket League Switch","Rock Band Track Pack Volume 2","Rocket League Switch","Rock Band Track Pack Volume 2","0.24137931034482762","0.24137931034482762"
"LinearCombinationMatchingRule","Games_Updated_ID_3161","vgsales_ID_2794","0.31034482758620685",,"The Dishwasher: Vampire Smile","The Sims 2: Castaway","The Dishwasher: Vampire Smile","The Sims 2: Castaway","0.31034482758620685","0.31034482758620685"
"LinearCombinationMatchingRule","Games_Updated_ID_3895","vgsales_ID_3127","0.46153846153846156",,"Star Ocean: The Last Hope International","Star Ocean: First Departure","Star Ocean: The Last Hope International","Star Ocean: First Departure","0.46153846153846156","0.46153846153846156"
"LinearCombinationMatchingRule","Games_Updated_ID_3161","vgsales_ID_12021","0.30188679245283023",,"The Dishwasher: Vampire Smile","The Legend of Heroes: Trails in the Sky First Chapter","The Dishwasher: Vampire Smile","The Legend of Heroes: Trails in the Sky First Chapter","0.30188679245283023","0.30188679245283023"
"LinearCombinationMatchingRule","Games_Updated_ID_1813","vgsales_ID_2082","0.3157894736842105",,"Deadfall Adventures","Dead Space 3","Deadfall Adventures","Dead Space 3","0.3157894736842105","0.3157894736842105"
"LinearCombinationMatchingRule","Games_Updated_ID_7017","vgsales_ID_4779","0.1917808219178082",,"Disgaea 2: Cursed Memories","Disney's Hercules / Disney's The Jungle Book: Groove Party / A Bug's Life","Disgaea 2: Cursed Memories","Disney's Hercules / Disney's The Jungle Book: Groove Party / A Bug's Life","0.1917808219178082","0.1917808219178082"
"LinearCombinationMatchingRule","Games_Updated_ID_1054","vgsales_ID_986","0.35",,"Dead Island: Riptide","Dead or Alive 3","Dead Island: Riptide","Dead or Alive 3","0.35","0.35"
"LinearCombinationMatchingRule","Games_Updated_ID_3811","vgsales_ID_8247","0.4736842105263158",,"The Misadventures of P.B. Winterbottom","The Grim Adventures of Billy & Mandy","The Misadventures of P.B. Winterbottom","The Grim Adventures of Billy & Mandy","0.4736842105263158","0.4736842105263158"
"LinearCombinationMatchingRule","Games_Updated_ID_3344","vgsales_ID_1796","0.33333333333333337",,"The Deadliest Catch: Sea of Chaos","The Lord of the Rings: The Return of the King","The Deadliest Catch: Sea of Chaos","The Lord of the Rings: The Return of the King","0.33333333333333337","0.33333333333333337"
"LinearCombinationMatchingRule","Games_Updated_ID_13374","vgsales_ID_2899","0.30000000000000004",,"NBA Full Court Press","NBA Live 09","NBA Full Court Press","NBA Live 09","0.30000000000000004","0.30000000000000004"
"LinearCombinationMatchingRule","Games_Updated_ID_8451","vgsales_ID_10300","0.38888888888888884",,"Robotron: 2084","Robotech: Invasion","Robotron: 2084","Robotech: Invasion","0.38888888888888884","0.38888888888888884"
"LinearCombinationMatchingRule","Games_Updated_ID_936","vgsales_ID_11920","0.41025641025641024",,"Monster Hunter Generations","Monster Rancher Battle Card: Episode II","Monster Hunter Generations","Monster Rancher Battle Card: Episode II","0.41025641025641024","0.41025641025641024"
"LinearCombinationMatchingRule","Games_Updated_ID_301","vgsales_ID_6997","0.17142857142857137",,"The Division 2  - National Treasure","The Club","The Division 2  - National Treasure","The Club","0.17142857142857137","0.17142857142857137"
"LinearCombinationMatchingRule","Games_Updated_ID_3677","vgsales_ID_3161","0.29032258064516125",,"The Simpsons Arcade","The Lord of the Rings: Conquest","The Simpsons Arcade","The Lord of the Rings: Conquest","0.29032258064516125","0.29032258064516125"
"LinearCombinationMatchingRule","Games_Updated_ID_5506","vgsales_ID_5969","0.6153846153846154",,"Need for Speed ProStreet","Need for Speed Underground","Need for Speed ProStreet","Need for Speed Underground","0.6153846153846154","0.6153846153846154"
"LinearCombinationMatchingRule","Games_Updated_ID_20","vgsales_ID_12460","0.23913043478260865",,"The Solitaire Conspiracy   Jack Of All Trades","The Great Escape","The Solitaire Conspiracy   Jack Of All Trades","The Great Escape","0.23913043478260865","0.23913043478260865"
"LinearCombinationMatchingRule","Games_Updated_ID_6617","vgsales_ID_12873","0.6",,"Cars","Carve","Cars","Carve","0.6","0.6"
"LinearCombinationMatchingRule","Games_Updated_ID_7961","vgsales_ID_9053","0.2702702702702703",,"Starships Unlimited: Divided Galaxies","Star Ocean: Blue Sphere","Starships Unlimited: Divided Galaxies","Star Ocean: Blue Sphere","0.2702702702702703","0.2702702702702703"
"LinearCombinationMatchingRule","Games_Updated_ID_257","vgsales_ID_3042","0.275",,"The Sinking City  - Draining","The Fairly Odd Parents: Breakin Da Rules","The Sinking City  - Draining","The Fairly Odd Parents: Breakin Da Rules","0.275","0.275"
"LinearCombinationMatchingRule","Games_Updated_ID_11376","vgsales_ID_9433","0.3571428571428571",,"The Messenger","The Unholy War","The Messenger","The Unholy War","0.3571428571428571","0.3571428571428571"
"LinearCombinationMatchingRule","Games_Updated_ID_9171","vgsales_ID_10717","0.1707317073170732",,"The Incredible Hulk: Ultimate Destruction","The BIGS 2","The Incredible Hulk: Ultimate Destruction","The BIGS 2","0.1707317073170732","0.1707317073170732"
"LinearCombinationMatchingRule","Games_Updated_ID_2262","vgsales_ID_8701","0.2142857142857143",,"The Walking Dead: Episode 5 - No Time Left","The Idolm@ster 2","The Walking Dead: Episode 5 - No Time Left","The Idolm@ster 2","0.2142857142857143","0.2142857142857143"
"LinearCombinationMatchingRule","Games_Updated_ID_1471","vgsales_ID_4999","0.38888888888888884",,"The Last of Us","The Cat in the Hat","The Last of Us","The Cat in the Hat","0.38888888888888884","0.38888888888888884"
"LinearCombinationMatchingRule","Games_Updated_ID_11201","vgsales_ID_3892","0.33333333333333337",,"The Hulk","The Saboteur","The Hulk","The Saboteur","0.33333333333333337","0.33333333333333337"
"LinearCombinationMatchingRule","Games_Updated_ID_9770","vgsales_ID_12630","0.34615384615384615",,"The Urbz: Sims in the City","The Fast and the Furious","The Urbz: Sims in the City","The Fast and the Furious","0.34615384615384615","0.34615384615384615"
"LinearCombinationMatchingRule","Games_Updated_ID_12702","vgsales_ID_2541","0.3023255813953488",,"The Operational Art of War, Vol. 1","The Legend of Zelda: Four Swords Adventures","The Operational Art of War, Vol. 1","The Legend of Zelda: Four Swords Adventures","0.3023255813953488","0.3023255813953488"
"LinearCombinationMatchingRule","Games_Updated_ID_1602","vgsales_ID_7657","0.2142857142857143",,"The Incredible Adventures of Van Helsing 2","The Cheetah Girls: Passport to Stardom","The Incredible Adventures of Van Helsing 2","The Cheetah Girls: Passport to Stardom","0.2142857142857143","0.2142857142857143"
"LinearCombinationMatchingRule","Games_Updated_ID_8851","vgsales_ID_1581","0.3157894736842105",,"Legend of Heroes: A Tear of Vermillion","LEGO The Lord of the Rings","Legend of Heroes: A Tear of Vermillion","LEGO The Lord of the Rings","0.3157894736842105","0.3157894736842105"
