"MatchingRule","Record1Identifier","Record2Identifier","TotalSimilarity","IsMatch","[0] GameTitleComparatorLevenshtein record1Value","[0] GameTitleComparatorLevenshtein record2Value","[0] GameTitleComparatorLevenshtein record1PreprocessedValue","[0] GameTitleComparatorLevenshtein record2PreprocessedValue","[0] GameTitleComparatorLevenshtein similarity","[0] GameTitleComparatorLevenshtein postproccesedSimilarity"
"LinearCombinationMatchingRule","Games_Updated_ID_9341","vgsales_ID_9807","0.23529411764705888",,"Galaga","Gallop Racer 2000","Galaga","Gallop Racer 2000","0.23529411764705888","0.23529411764705888"
"LinearCombinationMatchingRule","Games_Updated_ID_1099","vgsales_ID_11571","0.5384615384615384",,"Need For Speed","Need For Speed: Undercover","Need For Speed","Need For Speed: Undercover","0.5384615384615384","0.5384615384615384"
"LinearCombinationMatchingRule","Games_Updated_ID_6379","vgsales_ID_8527","0.9230769230769231",,"Major League Baseball 2K7","Major League Baseball 2K12","Major League Baseball 2K7","Major League Baseball 2K12","0.9230769230769231","0.9230769230769231"
"LinearCombinationMatchingRule","Games_Updated_ID_2830","vgsales_ID_4944","0.9166666666666666",,"Just Dance 3","Just Dance 4","Just Dance 3","Just Dance 4","0.9166666666666666","0.9166666666666666"
"LinearCombinationMatchingRule","Games_Updated_ID_1537","vgsales_ID_80","0.4285714285714286",,"Halfway","Halo 2","Halfway","Halo 2","0.4285714285714286","0.4285714285714286"
"LinearCombinationMatchingRule","Games_Updated_ID_10973","vgsales_ID_3484","0.4444444444444444",,"WWE Raw 2","WWE 2K16","WWE Raw 2","WWE 2K16","0.4444444444444444","0.4444444444444444"
"LinearCombinationMatchingRule","Games_Updated_ID_7210","vgsales_ID_11954","0.2222222222222222",,"Rockstar Games Presents Table Tennis","Rock Band Track Pack: Classic Rock","Rockstar Games Presents Table Tennis","Rock Band Track Pack: Classic Rock","0.2222222222222222","0.2222222222222222"
"LinearCombinationMatchingRule","Games_Updated_ID_7353","vgsales_ID_10889","0.30952380952380953",,"The Flintstones Bedrock Bowling","The Legend of Heroes: A Tear of Vermillion","The Flintstones Bedrock Bowling","The Legend of Heroes: A Tear of Vermillion","0.30952380952380953","0.30952380952380953"
"LinearCombinationMatchingRule","Games_Updated_ID_526","vgsales_ID_8261","0.16216216216216217",,"The Alliance Alive : A Change Of Pace","The Hobbit","The Alliance Alive : A Change Of Pace","The Hobbit","0.16216216216216217","0.16216216216216217"
"LinearCombinationMatchingRule","Games_Updated_ID_2448","vgsales_ID_3347","0.2727272727272727",,"The Amazing Spider-Man","The Golden Compass","The Amazing Spider-Man","The Golden Compass","0.2727272727272727","0.2727272727272727"
"LinearCombinationMatchingRule","Games_Updated_ID_13277","vgsales_ID_3982","0.3571428571428571",,"Superbike World Championship","Super Robot Taisen MX","Superbike World Championship","Super Robot Taisen MX","0.3571428571428571","0.3571428571428571"
"LinearCombinationMatchingRule","Games_Updated_ID_2740","vgsales_ID_2450","0.38888888888888884",,"Stronghold 3","Street Fighter EX3","Stronghold 3","Street Fighter EX3","0.38888888888888884","0.38888888888888884"
"LinearCombinationMatchingRule","Games_Updated_ID_5130","vgsales_ID_5303","0.19999999999999996",,"Dracula: Origin","Dragon Ball Z: Budokai Tenkaichi 2 (JP sales)","Dracula: Origin","Dragon Ball Z: Budokai Tenkaichi 2 (JP sales)","0.19999999999999996","0.19999999999999996"
"LinearCombinationMatchingRule","Games_Updated_ID_10575","vgsales_ID_6420","0.368421052631579",,"Super Trucks Racing","Superman Returns","Super Trucks Racing","Superman Returns","0.368421052631579","0.368421052631579"
"LinearCombinationMatchingRule","Games_Updated_ID_3486","vgsales_ID_9967","0.3529411764705882",,"Arcania: Gothic 4","Arctic Thunder","Arcania: Gothic 4","Arctic Thunder","0.3529411764705882","0.3529411764705882"
"LinearCombinationMatchingRule","Games_Updated_ID_3808","vgsales_ID_14255","0.2727272727272727",,"Beat Hazard","Beastly","Beat Hazard","Beastly","0.2727272727272727","0.2727272727272727"
"LinearCombinationMatchingRule","Games_Updated_ID_8968","vgsales_ID_91","1.0",,"Grand Theft Auto: Liberty City Stories","Grand Theft Auto: Liberty City Stories","Grand Theft Auto: Liberty City Stories","Grand Theft Auto: Liberty City Stories","1.0","1.0"
"LinearCombinationMatchingRule","Games_Updated_ID_7794","vgsales_ID_8513","0.2325581395348837",,"The Weakest Link","The Legend of Heroes VII: The Trail of Zero","The Weakest Link","The Legend of Heroes VII: The Trail of Zero","0.2325581395348837","0.2325581395348837"
"LinearCombinationMatchingRule","Games_Updated_ID_10516","vgsales_ID_1963","0.16666666666666663",,"Wars and Warriors: Joan of Arc","Warhawk","Wars and Warriors: Joan of Arc","Warhawk","0.16666666666666663","0.16666666666666663"
"LinearCombinationMatchingRule","Games_Updated_ID_6013","vgsales_ID_11062","0.29032258064516125",,"Superman Returns: The Videogame","Super Robot Taisen MX Portable","Superman Returns: The Videogame","Super Robot Taisen MX Portable","0.29032258064516125","0.29032258064516125"
"LinearCombinationMatchingRule","Games_Updated_ID_350","vgsales_ID_2196","0.26530612244897955",,"The Eternal Castle Remastered  - Vivid Flashbacks","The Tomb Raider Trilogy","The Eternal Castle Remastered  - Vivid Flashbacks","The Tomb Raider Trilogy","0.26530612244897955","0.26530612244897955"
"LinearCombinationMatchingRule","Games_Updated_ID_8487","vgsales_ID_7944","0.30434782608695654",,"Crash Tag Team Racing","Crash & Spyro Superpack","Crash Tag Team Racing","Crash & Spyro Superpack","0.30434782608695654","0.30434782608695654"
"LinearCombinationMatchingRule","Games_Updated_ID_8187","vgsales_ID_1506","0.19999999999999996",,"Madden NFL 2003","Madagascar","Madden NFL 2003","Madagascar","0.19999999999999996","0.19999999999999996"
"LinearCombinationMatchingRule","Games_Updated_ID_6042","vgsales_ID_11091","0.33333333333333337",,"Prince of Persia: The Two Thrones","Prinny: Can I Really Be the Hero?","Prince of Persia: The Two Thrones","Prinny: Can I Really Be the Hero?","0.33333333333333337","0.33333333333333337"
"LinearCombinationMatchingRule","Games_Updated_ID_12095","vgsales_ID_480","0.41463414634146345",,"Star Wars Rogue Leader: Rogue Squadron II","Star Wars: The Old Republic","Star Wars Rogue Leader: Rogue Squadron II","Star Wars: The Old Republic","0.41463414634146345","0.41463414634146345"
"LinearCombinationMatchingRule","Games_Updated_ID_14093","vgsales_ID_11302","0.22916666666666663",,"The New Tetris","The King of Fighters '98: Dream Match Never Ends","The New Tetris","The King of Fighters '98: Dream Match Never Ends","0.22916666666666663","0.22916666666666663"
"LinearCombinationMatchingRule","Games_Updated_ID_722","vgsales_ID_8213","0.15384615384615385",,"Arms","Army Men: Sarge's Heroes 2","Arms","Army Men: Sarge's Heroes 2","0.15384615384615385","0.15384615384615385"
"LinearCombinationMatchingRule","Games_Updated_ID_10030","vgsales_ID_8550","0.6666666666666667",,"Dynasty Warriors 4: Empires","Dynasty Warriors 4","Dynasty Warriors 4: Empires","Dynasty Warriors 4","0.6666666666666667","0.6666666666666667"
"LinearCombinationMatchingRule","Games_Updated_ID_11202","vgsales_ID_3892","0.3157894736842105",,"The Incredible Hulk","The Saboteur","The Incredible Hulk","The Saboteur","0.3157894736842105","0.3157894736842105"
"LinearCombinationMatchingRule","Games_Updated_ID_7791","vgsales_ID_8515","0.33333333333333337",,"Kinetica","King's Field","Kinetica","King's Field","0.33333333333333337","0.33333333333333337"
"LinearCombinationMatchingRule","Games_Updated_ID_4059","vgsales_ID_11402","0.2432432432432432",,"Star Wars Battlefront: Elite Squadron","State of Emergency 2","Star Wars Battlefront: Elite Squadron","State of Emergency 2","0.2432432432432432","0.2432432432432432"
"LinearCombinationMatchingRule","Games_Updated_ID_10027","vgsales_ID_6392","0.375",,"The Guy Game","The Sims 2: Pets","The Guy Game","The Sims 2: Pets","0.375","0.375"
"LinearCombinationMatchingRule","Games_Updated_ID_9059","vgsales_ID_15540","0.2068965517241379",,"The Suffering: Ties That Bind","The Talos Principle","The Suffering: Ties That Bind","The Talos Principle","0.2068965517241379","0.2068965517241379"
"LinearCombinationMatchingRule","Games_Updated_ID_6554","vgsales_ID_5582","0.3902439024390244",,"One Piece: Pirates Carnival","One Piece: Romance Dawn - Bouken no Yoake","One Piece: Pirates Carnival","One Piece: Romance Dawn - Bouken no Yoake","0.3902439024390244","0.3902439024390244"
"LinearCombinationMatchingRule","Games_Updated_ID_215","vgsales_ID_2909","0.2295081967213115",,"The Legend Of Zelda: Links Awakening  - A Respectable Remake","The Sims 2: Apartment Pets","The Legend Of Zelda: Links Awakening  - A Respectable Remake","The Sims 2: Apartment Pets","0.2295081967213115","0.2295081967213115"
"LinearCombinationMatchingRule","Games_Updated_ID_7809","vgsales_ID_6658","0.30000000000000004",,"The Sims: Hot Date","The Powerpuff Girls: Chemical X-Traction","The Sims: Hot Date","The Powerpuff Girls: Chemical X-Traction","0.30000000000000004","0.30000000000000004"
"LinearCombinationMatchingRule","Games_Updated_ID_11672","vgsales_ID_2640","0.17500000000000004",,"Mario Party 4","Marvel vs. Capcom: Clash of Super Heroes","Mario Party 4","Marvel vs. Capcom: Clash of Super Heroes","0.17500000000000004","0.17500000000000004"
"LinearCombinationMatchingRule","Games_Updated_ID_4357","vgsales_ID_10505","0.26086956521739135",,"The Punisher: No Mercy","The Story of Noah's Ark","The Punisher: No Mercy","The Story of Noah's Ark","0.26086956521739135","0.26086956521739135"
"LinearCombinationMatchingRule","Games_Updated_ID_1242","vgsales_ID_927","0.29166666666666663",,"The Witcher 3: Wild Hunt","The Legend of Dragoon","The Witcher 3: Wild Hunt","The Legend of Dragoon","0.29166666666666663","0.29166666666666663"
"LinearCombinationMatchingRule","Games_Updated_ID_9266","vgsales_ID_7307","0.3076923076923077",,"Evel Knievel Evel-ution 3D","EVE Online","Evel Knievel Evel-ution 3D","EVE Online","0.3076923076923077","0.3076923076923077"
"LinearCombinationMatchingRule","Games_Updated_ID_6856","vgsales_ID_13813","0.303030303030303",,"Valkyrie Profile 2: Silmeria","Valhalla Knights 2: Battle Stance","Valkyrie Profile 2: Silmeria","Valhalla Knights 2: Battle Stance","0.303030303030303","0.303030303030303"
"LinearCombinationMatchingRule","Games_Updated_ID_2261","vgsales_ID_8701","0.2142857142857143",,"The Walking Dead: Episode 5 - No Time Left","The Idolm@ster 2","The Walking Dead: Episode 5 - No Time Left","The Idolm@ster 2","0.2142857142857143","0.2142857142857143"
"LinearCombinationMatchingRule","Games_Updated_ID_9920","vgsales_ID_13157","0.2666666666666667",,"The Incredibles","The History Channel: Great Battles - Medieval","The Incredibles","The History Channel: Great Battles - Medieval","0.2666666666666667","0.2666666666666667"
"LinearCombinationMatchingRule","Games_Updated_ID_10334","vgsales_ID_9810","0.34375",,"ChessEverywhere","Chessmaster: The Art of Learning","ChessEverywhere","Chessmaster: The Art of Learning","0.34375","0.34375"
"LinearCombinationMatchingRule","Games_Updated_ID_10479","vgsales_ID_6343","0.3157894736842105",,"NBA Live 2000","NBA In The Zone '98","NBA Live 2000","NBA In The Zone '98","0.3157894736842105","0.3157894736842105"
"LinearCombinationMatchingRule","Games_Updated_ID_8678","vgsales_ID_13904","0.2692307692307693",,"The Outfit","The Treasures of Montezuma","The Outfit","The Treasures of Montezuma","0.2692307692307693","0.2692307692307693"
"LinearCombinationMatchingRule","Games_Updated_ID_6618","vgsales_ID_12873","0.6",,"Cars","Carve","Cars","Carve","0.6","0.6"
"LinearCombinationMatchingRule","Games_Updated_ID_4675","vgsales_ID_6119","0.303030303030303",,"Metal Slug 7","Metal Gear Solid V: Ground Zeroes","Metal Slug 7","Metal Gear Solid V: Ground Zeroes","0.303030303030303","0.303030303030303"
"LinearCombinationMatchingRule","Games_Updated_ID_5957","vgsales_ID_12004","0.41666666666666663",,"The BIGS","The Guy Game","The BIGS","The Guy Game","0.41666666666666663","0.41666666666666663"
"LinearCombinationMatchingRule","Games_Updated_ID_587","vgsales_ID_10359","0.33333333333333337",,"The Inpatient","The Book of Unwritten Tales","The Inpatient","The Book of Unwritten Tales","0.33333333333333337","0.33333333333333337"
"LinearCombinationMatchingRule","Games_Updated_ID_720","vgsales_ID_7002","0.2564102564102564",,"The Town Of Light","The Scorpion King: Rise of the Akkadian","The Town Of Light","The Scorpion King: Rise of the Akkadian","0.2564102564102564","0.2564102564102564"
"LinearCombinationMatchingRule","Games_Updated_ID_8765","vgsales_ID_13147","0.30434782608695654",,"The King of Fighters M2","The Lost Vikings","The King of Fighters M2","The Lost Vikings","0.30434782608695654","0.30434782608695654"
"LinearCombinationMatchingRule","Games_Updated_ID_3503","vgsales_ID_1939","0.12",,"MorphX","Mortal Kombat: Armageddon","MorphX","Mortal Kombat: Armageddon","0.12","0.12"
"LinearCombinationMatchingRule","Games_Updated_ID_4647","vgsales_ID_11151","0.22580645161290325",,"The Lord of the Rings: Conquest","The Smurfs 2","The Lord of the Rings: Conquest","The Smurfs 2","0.22580645161290325","0.22580645161290325"
"LinearCombinationMatchingRule","Games_Updated_ID_12057","vgsales_ID_430","0.5217391304347826",,"Super Smash Bros. Melee","Super Mario Maker","Super Smash Bros. Melee","Super Mario Maker","0.5217391304347826","0.5217391304347826"
"LinearCombinationMatchingRule","Games_Updated_ID_3401","vgsales_ID_3146","0.5",,"NBA Jam","NBA 2K17","NBA Jam","NBA 2K17","0.5","0.5"
"LinearCombinationMatchingRule","Games_Updated_ID_13630","vgsales_ID_878","0.4285714285714286",,"FIFA 99","FIFA Soccer 09","FIFA 99","FIFA Soccer 09","0.4285714285714286","0.4285714285714286"
"LinearCombinationMatchingRule","Games_Updated_ID_13311","vgsales_ID_4146","0.38888888888888884",,"Sonic CD","Sonic the Hedgehog","Sonic CD","Sonic the Hedgehog","0.38888888888888884","0.38888888888888884"
"LinearCombinationMatchingRule","Games_Updated_ID_6585","vgsales_ID_2848","0.26315789473684215",,"Superman Returns: Fortress of Solitude","Super Monkey Ball Jr.","Superman Returns: Fortress of Solitude","Super Monkey Ball Jr.","0.26315789473684215","0.26315789473684215"
"LinearCombinationMatchingRule","Games_Updated_ID_7656","vgsales_ID_1553","0.28125",,"The Adventures of Cookie & Cream","The Sims 2: Nightlife","The Adventures of Cookie & Cream","The Sims 2: Nightlife","0.28125","0.28125"
"LinearCombinationMatchingRule","Games_Updated_ID_9702","vgsales_ID_815","0.13235294117647056",,"The Chronicles of Riddick: Escape From Butcher Bay - Developer's Cut","The Sims 3","The Chronicles of Riddick: Escape From Butcher Bay - Developer's Cut","The Sims 3","0.13235294117647056","0.13235294117647056"
"LinearCombinationMatchingRule","Games_Updated_ID_5966","vgsales_ID_13229","0.22033898305084743",,"World Championship Poker: Featuring Howard Lederer - All In","Worms Reloaded","World Championship Poker: Featuring Howard Lederer - All In","Worms Reloaded","0.22033898305084743","0.22033898305084743"
"LinearCombinationMatchingRule","Games_Updated_ID_8740","vgsales_ID_7103","0.33333333333333337",,"The Rub Rabbits!","The Raiden Project","The Rub Rabbits!","The Raiden Project","0.33333333333333337","0.33333333333333337"
"LinearCombinationMatchingRule","Games_Updated_ID_7513","vgsales_ID_6339","0.3846153846153846",,"Spider-Man","Spider-Man: Web of Shadows","Spider-Man","Spider-Man: Web of Shadows","0.3846153846153846","0.3846153846153846"
"LinearCombinationMatchingRule","Games_Updated_ID_8582","vgsales_ID_11640","0.3589743589743589",,"World Poker Tour","World Championship Poker: Deluxe Series","World Poker Tour","World Championship Poker: Deluxe Series","0.3589743589743589","0.3589743589743589"
"LinearCombinationMatchingRule","Games_Updated_ID_2536","vgsales_ID_5855","0.30434782608695654",,"Blacklight: Retribution","Blazing Heroes","Blacklight: Retribution","Blazing Heroes","0.30434782608695654","0.30434782608695654"
"LinearCombinationMatchingRule","Games_Updated_ID_3127","vgsales_ID_4091","0.34615384615384615",,"The Fancy Pants Adventures","The Sims 2: Pets","The Fancy Pants Adventures","The Sims 2: Pets","0.34615384615384615","0.34615384615384615"
"LinearCombinationMatchingRule","Games_Updated_ID_13016","vgsales_ID_2506","0.8461538461538461",,"Madden NFL 98","Madden NFL 17","Madden NFL 98","Madden NFL 17","0.8461538461538461","0.8461538461538461"
"LinearCombinationMatchingRule","Games_Updated_ID_2487","vgsales_ID_12512","0.3157894736842105",,"Mario Tennis Open","Marvel Super Heroes","Mario Tennis Open","Marvel Super Heroes","0.3157894736842105","0.3157894736842105"
"LinearCombinationMatchingRule","Games_Updated_ID_8727","vgsales_ID_2669","0.25531914893617025",,"Marc Ecko's Getting Up: Contents Under Pressure","Marvel Nemesis: Rise of the Imperfects","Marc Ecko's Getting Up: Contents Under Pressure","Marvel Nemesis: Rise of the Imperfects","0.25531914893617025","0.25531914893617025"
"LinearCombinationMatchingRule","Games_Updated_ID_11441","vgsales_ID_8584","0.25",,"The Mystery of the Mummy","The Powerpuff Girls: Chemical X-Traction","The Mystery of the Mummy","The Powerpuff Girls: Chemical X-Traction","0.25","0.25"
"LinearCombinationMatchingRule","Games_Updated_ID_1091","vgsales_ID_7733","0.3125",,"The Park","The Great Escape","The Park","The Great Escape","0.3125","0.3125"
"LinearCombinationMatchingRule","Games_Updated_ID_820","vgsales_ID_8316","0.21176470588235297",,"The Walking Dead: The Telltale Series - A New Frontier Ep. 2: Ties That Bind Part Two","The Rise of the Argonauts","The Walking Dead: The Telltale Series - A New Frontier Ep. 2: Ties That Bind Part Two","The Rise of the Argonauts","0.21176470588235297","0.21176470588235297"
"LinearCombinationMatchingRule","Games_Updated_ID_2323","vgsales_ID_1927","0.32432432432432434",,"Professor Layton and the Miracle Mask","Pro Evolution Soccer 2008","Professor Layton and the Miracle Mask","Pro Evolution Soccer 2008","0.32432432432432434","0.32432432432432434"
"LinearCombinationMatchingRule","Games_Updated_ID_8644","vgsales_ID_13292","0.25",,"Kingdom Hearts II","Kiniro no Corda 2 Encore","Kingdom Hearts II","Kiniro no Corda 2 Encore","0.25","0.25"
"LinearCombinationMatchingRule","Games_Updated_ID_445","vgsales_ID_7820","0.2727272727272727",,"Planet Alpha : A Beautiful Planet","Plants vs. Zombies","Planet Alpha : A Beautiful Planet","Plants vs. Zombies","0.2727272727272727","0.2727272727272727"
"LinearCombinationMatchingRule","Games_Updated_ID_9701","vgsales_ID_816","0.5",,"Tom Clancy's Ghost Recon 2","Tom Clancy's Splinter Cell: Conviction","Tom Clancy's Ghost Recon 2","Tom Clancy's Splinter Cell: Conviction","0.5","0.5"
"LinearCombinationMatchingRule","Games_Updated_ID_1179","vgsales_ID_2294","0.7083333333333333",,"The Simpsons Arcade Game","The Simpsons Game","The Simpsons Arcade Game","The Simpsons Game","0.7083333333333333","0.7083333333333333"
"LinearCombinationMatchingRule","Games_Updated_ID_4196","vgsales_ID_12756","0.28260869565217395",,"The Warriors: Street Brawl","The Mysterious Case of Dr. Jekyll and Mr. Hyde","The Warriors: Street Brawl","The Mysterious Case of Dr. Jekyll and Mr. Hyde","0.28260869565217395","0.28260869565217395"
"LinearCombinationMatchingRule","Games_Updated_ID_4896","vgsales_ID_11145","0.25",,"The Witcher Enhanced Edition","The Ant Bully","The Witcher Enhanced Edition","The Ant Bully","0.25","0.25"
"LinearCombinationMatchingRule","Games_Updated_ID_3252","vgsales_ID_110","0.25806451612903225",,"Fallout: New Vegas - Dead Money","Fallout 4","Fallout: New Vegas - Dead Money","Fallout 4","0.25806451612903225","0.25806451612903225"
"LinearCombinationMatchingRule","Games_Updated_ID_345","vgsales_ID_752","0.3728813559322034",,"Mario & Luigi: Bowser's Inside Story + Bowser Jr.'s Journey","Mario & Luigi: Superstar Saga","Mario & Luigi: Bowser's Inside Story + Bowser Jr.'s Journey","Mario & Luigi: Superstar Saga","0.3728813559322034","0.3728813559322034"
"LinearCombinationMatchingRule","Games_Updated_ID_9642","vgsales_ID_13973","0.5833333333333333",,"Chaos League","Chaos Wars","Chaos League","Chaos Wars","0.5833333333333333","0.5833333333333333"
"LinearCombinationMatchingRule","Games_Updated_ID_6307","vgsales_ID_9926","0.17142857142857137",,"The Mark","The Walking Dead: Survival Instinct","The Mark","The Walking Dead: Survival Instinct","0.17142857142857137","0.17142857142857137"
"LinearCombinationMatchingRule","Games_Updated_ID_6427","vgsales_ID_10270","0.23076923076923073",,"The Warriors","The Scorpion King: Rise of the Akkadian","The Warriors","The Scorpion King: Rise of the Akkadian","0.23076923076923073","0.23076923076923073"
"LinearCombinationMatchingRule","Games_Updated_ID_8618","vgsales_ID_269","0.33333333333333337",,"The King of Fighters NeoWave","The Legend of Zelda: Ocarina of Time","The King of Fighters NeoWave","The Legend of Zelda: Ocarina of Time","0.33333333333333337","0.33333333333333337"
"LinearCombinationMatchingRule","Games_Updated_ID_6714","vgsales_ID_9218","0.3793103448275862",,"Star Trek: Encounters","Star Wars: Jedi Power Battles","Star Trek: Encounters","Star Wars: Jedi Power Battles","0.3793103448275862","0.3793103448275862"
"LinearCombinationMatchingRule","Games_Updated_ID_8674","vgsales_ID_4505","0.17741935483870963",,"The Apprentice","The Chronicles of Narnia: The Lion, The Witch and The Wardrobe","The Apprentice","The Chronicles of Narnia: The Lion, The Witch and The Wardrobe","0.17741935483870963","0.17741935483870963"
"LinearCombinationMatchingRule","Games_Updated_ID_13568","vgsales_ID_9085","0.2857142857142857",,"Heroes of Might and Magic III: Armageddon's Blade","Hero's Saga Laevatein Tactics","Heroes of Might and Magic III: Armageddon's Blade","Hero's Saga Laevatein Tactics","0.2857142857142857","0.2857142857142857"
"LinearCombinationMatchingRule","Games_Updated_ID_4595","vgsales_ID_7266","0.4545454545454546",,"Death Tank","Dead Island","Death Tank","Dead Island","0.4545454545454546","0.4545454545454546"
"LinearCombinationMatchingRule","Games_Updated_ID_2867","vgsales_ID_15436","0.16000000000000003",,"Dark Souls","Dark Tales: Edgar Allan Poe's The Premature Burial","Dark Souls","Dark Tales: Edgar Allan Poe's The Premature Burial","0.16000000000000003","0.16000000000000003"
"LinearCombinationMatchingRule","Games_Updated_ID_9140","vgsales_ID_3990","0.42105263157894735",,"Star Wars: Republic Commando: Order 66","Star Wars: Clone Wars","Star Wars: Republic Commando: Order 66","Star Wars: Clone Wars","0.42105263157894735","0.42105263157894735"
"LinearCombinationMatchingRule","Games_Updated_ID_14611","vgsales_ID_2704","0.275",,"The Journeyman Project 3: Legacy of Time","The Lord of the Rings: Conquest","The Journeyman Project 3: Legacy of Time","The Lord of the Rings: Conquest","0.275","0.275"
"LinearCombinationMatchingRule","Games_Updated_ID_10779","vgsales_ID_3029","0.25",,"The Hobbit","The LEGO Movie Videogame","The Hobbit","The LEGO Movie Videogame","0.25","0.25"
"LinearCombinationMatchingRule","Games_Updated_ID_5630","vgsales_ID_196","0.34615384615384615",,"Guilty Gear XX Accent Core","Guitar Hero II","Guilty Gear XX Accent Core","Guitar Hero II","0.34615384615384615","0.34615384615384615"
"LinearCombinationMatchingRule","Games_Updated_ID_2927","vgsales_ID_332","0.29166666666666663",,"The Baconing","The Witcher 3: Wild Hunt","The Baconing","The Witcher 3: Wild Hunt","0.29166666666666663","0.29166666666666663"
"LinearCombinationMatchingRule","Games_Updated_ID_4556","vgsales_ID_4958","0.375",,"The Last Remnant","The Sims 2","The Last Remnant","The Sims 2","0.375","0.375"
"LinearCombinationMatchingRule","Games_Updated_ID_10001","vgsales_ID_362","0.22580645161290325",,"The Price Is Right CliffHangers","The Getaway","The Price Is Right CliffHangers","The Getaway","0.22580645161290325","0.22580645161290325"
"LinearCombinationMatchingRule","Games_Updated_ID_6963","vgsales_ID_2109","0.4666666666666667",,"Just Cause","Just Dance 2014","Just Cause","Just Dance 2014","0.4666666666666667","0.4666666666666667"
"LinearCombinationMatchingRule","Games_Updated_ID_9768","vgsales_ID_13849","0.3076923076923077",,"The Urbz: Sims in the City","The Adventures of Darwin","The Urbz: Sims in the City","The Adventures of Darwin","0.3076923076923077","0.3076923076923077"
"LinearCombinationMatchingRule","Games_Updated_ID_14042","vgsales_ID_4568","0.26315789473684215",,"Neo Geo Cup '98 Plus Color","Neon Genesis Evangelion 2nd Impression","Neo Geo Cup '98 Plus Color","Neon Genesis Evangelion 2nd Impression","0.26315789473684215","0.26315789473684215"
"LinearCombinationMatchingRule","Games_Updated_ID_5056","vgsales_ID_6451","0.30434782608695654",,"The SimCity Box","The House of the Dead 2","The SimCity Box","The House of the Dead 2","0.30434782608695654","0.30434782608695654"
"LinearCombinationMatchingRule","Games_Updated_ID_7396","vgsales_ID_10405","0.24",,"Professional Bull Rider 2","Project: Horned Owl","Professional Bull Rider 2","Project: Horned Owl","0.24","0.24"
"LinearCombinationMatchingRule","Games_Updated_ID_8829","vgsales_ID_14679","0.22580645161290325",,"The Chronicles of Narnia: The Lion, The Witch and The Wardrobe","The IdolM@ster: Gravure For You! Vol. 6","The Chronicles of Narnia: The Lion, The Witch and The Wardrobe","The IdolM@ster: Gravure For You! Vol. 6","0.22580645161290325","0.22580645161290325"
"LinearCombinationMatchingRule","Games_Updated_ID_8404","vgsales_ID_925","0.23076923076923073",,"Madagascar","Madden NFL 06","Madagascar","Madden NFL 06","0.23076923076923073","0.23076923076923073"
"LinearCombinationMatchingRule","Games_Updated_ID_8225","vgsales_ID_971","0.22857142857142854",,"King of Fighters EX2: Howling Blood","Kinect Star Wars","King of Fighters EX2: Howling Blood","Kinect Star Wars","0.22857142857142854","0.22857142857142854"
