"MatchingRule","Record1Identifier","Record2Identifier","TotalSimilarity","IsMatch","[0] GameTitleComparatorLevenshtein record1Value","[0] GameTitleComparatorLevenshtein record2Value","[0] GameTitleComparatorLevenshtein record1PreprocessedValue","[0] GameTitleComparatorLevenshtein record2PreprocessedValue","[0] GameTitleComparatorLevenshtein similarity","[0] GameTitleComparatorLevenshtein postproccesedSimilarity"
"LinearCombinationMatchingRule","Games_Updated_ID_641","vgsales_ID_6806","0.36363636363636365",,"The Flame in the Flood","The Incredible Hulk","The Flame in the Flood","The Incredible Hulk","0.36363636363636365","0.36363636363636365"
"LinearCombinationMatchingRule","Games_Updated_ID_10725","vgsales_ID_5636","0.27586206896551724",,"FIFA Soccer 2004","FIFA 2001 Major League Soccer","FIFA Soccer 2004","FIFA 2001 Major League Soccer","0.27586206896551724","0.27586206896551724"
"LinearCombinationMatchingRule","Games_Updated_ID_7029","vgsales_ID_946","0.2777777777777778",,"World Racing 2","World of Warcraft: Mists of Pandaria","World Racing 2","World of Warcraft: Mists of Pandaria","0.2777777777777778","0.2777777777777778"
"LinearCombinationMatchingRule","Games_Updated_ID_1066","vgsales_ID_5785","0.6086956521739131",,"Final Fantasy Explorers","Final Fantasy IV","Final Fantasy Explorers","Final Fantasy IV","0.6086956521739131","0.6086956521739131"
"LinearCombinationMatchingRule","Games_Updated_ID_7192","vgsales_ID_2290","0.3928571428571429",,"Super Text Twist","Super Momotarou Dentetsu III","Super Text Twist","Super Momotarou Dentetsu III","0.3928571428571429","0.3928571428571429"
"LinearCombinationMatchingRule","Games_Updated_ID_4784","vgsales_ID_15600","0.23728813559322037",,"The Golden Horde","The King of Fighters Collection: The Orochi Saga (JP sales)","The Golden Horde","The King of Fighters Collection: The Orochi Saga (JP sales)","0.23728813559322037","0.23728813559322037"
"LinearCombinationMatchingRule","Games_Updated_ID_11986","vgsales_ID_1502","0.19999999999999996",,"The King of Fighters 2001","The Beatles: Rock Band","The King of Fighters 2001","The Beatles: Rock Band","0.19999999999999996","0.19999999999999996"
"LinearCombinationMatchingRule","Games_Updated_ID_9317","vgsales_ID_681","0.29729729729729726",,"The Longest Yard","The Legend of Zelda: Majora's Mask 3D","The Longest Yard","The Legend of Zelda: Majora's Mask 3D","0.29729729729729726","0.29729729729729726"
"LinearCombinationMatchingRule","Games_Updated_ID_1956","vgsales_ID_3199","0.5333333333333333",,"Disney Infinity","Disney Universe","Disney Infinity","Disney Universe","0.5333333333333333","0.5333333333333333"
"LinearCombinationMatchingRule","Games_Updated_ID_8172","vgsales_ID_7643","0.19354838709677424",,"The Elder Scrolls III: Tribunal","The BIGS 2","The Elder Scrolls III: Tribunal","The BIGS 2","0.19354838709677424","0.19354838709677424"
"LinearCombinationMatchingRule","Games_Updated_ID_6293","vgsales_ID_7473","0.15384615384615385",,"Theme Park","The Naked Brothers Band: The Video Game","Theme Park","The Naked Brothers Band: The Video Game","0.15384615384615385","0.15384615384615385"
"LinearCombinationMatchingRule","Games_Updated_ID_6293","vgsales_ID_9891","0.2142857142857143",,"Theme Park","The Walking Dead: Season Two","Theme Park","The Walking Dead: Season Two","0.2142857142857143","0.2142857142857143"
"LinearCombinationMatchingRule","Games_Updated_ID_524","vgsales_ID_11505","0.28205128205128205",,"The Invisible Hours : From Every Angle","The King of Fighters EX2: Howling Blood","The Invisible Hours : From Every Angle","The King of Fighters EX2: Howling Blood","0.28205128205128205","0.28205128205128205"
"LinearCombinationMatchingRule","Games_Updated_ID_1004","vgsales_ID_13918","0.21818181818181814",,"The Walking Dead: Michonne - Episode 2: Give No Shelter","The Ripping Friends","The Walking Dead: Michonne - Episode 2: Give No Shelter","The Ripping Friends","0.21818181818181814","0.21818181818181814"
"LinearCombinationMatchingRule","Games_Updated_ID_982","vgsales_ID_3799","0.3157894736842105",,"Alienation","Alice in Wonderland","Alienation","Alice in Wonderland","0.3157894736842105","0.3157894736842105"
"LinearCombinationMatchingRule","Games_Updated_ID_11360","vgsales_ID_8232","0.30000000000000004",,"The King of Route 66","The Chronicles of Narnia: Prince Caspian","The King of Route 66","The Chronicles of Narnia: Prince Caspian","0.30000000000000004","0.30000000000000004"
"LinearCombinationMatchingRule","Games_Updated_ID_13899","vgsales_ID_876","0.42105263157894735",,"NBA Basketball 2000","NBA Street Vol. 2","NBA Basketball 2000","NBA Street Vol. 2","0.42105263157894735","0.42105263157894735"
"LinearCombinationMatchingRule","Games_Updated_ID_8232","vgsales_ID_9288","0.9545454545454546",,"Hot Wheels World Race","Hot Wheels: World Race","Hot Wheels World Race","Hot Wheels: World Race","0.9545454545454546","0.9545454545454546"
"LinearCombinationMatchingRule","Games_Updated_ID_10835","vgsales_ID_8006","0.5",,"The Black Mirror","The Last Airbender","The Black Mirror","The Last Airbender","0.5","0.5"
"LinearCombinationMatchingRule","Games_Updated_ID_11360","vgsales_ID_14250","0.4",,"The King of Route 66","The Binding of Isaac","The King of Route 66","The Binding of Isaac","0.4","0.4"
"LinearCombinationMatchingRule","Games_Updated_ID_2814","vgsales_ID_1565","0.19444444444444442",,"Rocksmith","Rockstar Games presents Table Tennis","Rocksmith","Rockstar Games presents Table Tennis","0.19444444444444442","0.19444444444444442"
"LinearCombinationMatchingRule","Games_Updated_ID_8932","vgsales_ID_3826","0.30434782608695654",,"The Matrix: Path of Neo","The Grinch","The Matrix: Path of Neo","The Grinch","0.30434782608695654","0.30434782608695654"
"LinearCombinationMatchingRule","Games_Updated_ID_4509","vgsales_ID_4045","0.5263157894736843",,"Pokemon Platinum","Pokemon Art Academy","Pokemon Platinum","Pokemon Art Academy","0.5263157894736843","0.5263157894736843"
"LinearCombinationMatchingRule","Games_Updated_ID_8322","vgsales_ID_4694","0.5",,"Tom Clancy's Ghost Recon 2","Tom Clancy's Rainbow Six: Lockdown","Tom Clancy's Ghost Recon 2","Tom Clancy's Rainbow Six: Lockdown","0.5","0.5"
"LinearCombinationMatchingRule","Games_Updated_ID_2328","vgsales_ID_13823","0.24489795918367352",,"The Walking Dead - Episode 4: Around Every Corner","The Chase: Felix Meets Felicity","The Walking Dead - Episode 4: Around Every Corner","The Chase: Felix Meets Felicity","0.24489795918367352","0.24489795918367352"
"LinearCombinationMatchingRule","Games_Updated_ID_7537","vgsales_ID_2882","0.3666666666666667",,"Powerpuff Girls: Bad Mojo Jojo","Power Rangers: Dino Thunder","Powerpuff Girls: Bad Mojo Jojo","Power Rangers: Dino Thunder","0.3666666666666667","0.3666666666666667"
"LinearCombinationMatchingRule","Games_Updated_ID_4753","vgsales_ID_5267","0.19354838709677424",,"Transformers Animated: The Game","Trauma Center: Second Opinion","Transformers Animated: The Game","Trauma Center: Second Opinion","0.19354838709677424","0.19354838709677424"
"LinearCombinationMatchingRule","Games_Updated_ID_2904","vgsales_ID_7540","0.25806451612903225",,"The Gunstringer","The Ultimate Red Ball Challenge","The Gunstringer","The Ultimate Red Ball Challenge","0.25806451612903225","0.25806451612903225"
"LinearCombinationMatchingRule","Games_Updated_ID_14720","vgsales_ID_12315","0.19999999999999996",,"RayStorm","Rayman: Hoodlum's Revenge","RayStorm","Rayman: Hoodlum's Revenge","0.19999999999999996","0.19999999999999996"
"LinearCombinationMatchingRule","Games_Updated_ID_14606","vgsales_ID_2976","0.25",,"Starcraft","Star Wars: Masters of Teras Kasi","Starcraft","Star Wars: Masters of Teras Kasi","0.25","0.25"
"LinearCombinationMatchingRule","Games_Updated_ID_13786","vgsales_ID_12520","0.2727272727272727",,"Blaze & Blade - Eternal Quest","BlazBlue: Chrono Phantasma Extend","Blaze & Blade - Eternal Quest","BlazBlue: Chrono Phantasma Extend","0.2727272727272727","0.2727272727272727"
"LinearCombinationMatchingRule","Games_Updated_ID_2449","vgsales_ID_6973","0.4",,"Lego Batman 2: DC Super Heroes","LEGO Marvel's Avengers","Lego Batman 2: DC Super Heroes","LEGO Marvel's Avengers","0.4","0.4"
"LinearCombinationMatchingRule","Games_Updated_ID_4976","vgsales_ID_14852","0.46875",,"Monster Madness: Grave Danger","Monster Mayhem: Build and Battle","Monster Madness: Grave Danger","Monster Mayhem: Build and Battle","0.46875","0.46875"
"LinearCombinationMatchingRule","Games_Updated_ID_302","vgsales_ID_6997","0.1470588235294118",,"The World Next Door  - Anime Angst","The Club","The World Next Door  - Anime Angst","The Club","0.1470588235294118","0.1470588235294118"
"LinearCombinationMatchingRule","Games_Updated_ID_7627","vgsales_ID_14644","0.25",,"Triple Play Baseball","Trine 2","Triple Play Baseball","Trine 2","0.25","0.25"
"LinearCombinationMatchingRule","Games_Updated_ID_12946","vgsales_ID_7469","0.23809523809523814",,"NHL Championship 2000","NHL 2K3","NHL Championship 2000","NHL 2K3","0.23809523809523814","0.23809523809523814"
"LinearCombinationMatchingRule","Games_Updated_ID_3371","vgsales_ID_15866","0.7837837837837838",,"PDC World Championship Darts Pro Tour","PDC World Championship Darts 2008","PDC World Championship Darts Pro Tour","PDC World Championship Darts 2008","0.7837837837837838","0.7837837837837838"
"LinearCombinationMatchingRule","Games_Updated_ID_12864","vgsales_ID_13124","0.19999999999999996",,"Steel Harbinger","Steins;Gate 0","Steel Harbinger","Steins;Gate 0","0.19999999999999996","0.19999999999999996"
"LinearCombinationMatchingRule","Games_Updated_ID_3196","vgsales_ID_9420","0.21621621621621623",,"Tom Clancy's Ghost Recon: Shadow Wars","Tomb Raider: Legend","Tom Clancy's Ghost Recon: Shadow Wars","Tomb Raider: Legend","0.21621621621621623","0.21621621621621623"
"LinearCombinationMatchingRule","Games_Updated_ID_9257","vgsales_ID_12369","0.22580645161290325",,"The Bard's Tale","The Amazing Spider-Man 2 (2014)","The Bard's Tale","The Amazing Spider-Man 2 (2014)","0.22580645161290325","0.22580645161290325"
"LinearCombinationMatchingRule","Games_Updated_ID_6574","vgsales_ID_14985","0.17525773195876293",,"History Channel: Civil War","Hisshou Pachinko*Pachi-Slot Kouryaku Series DS Vol. 1: Shinseiki Evangelion - Magokoro o, Kimi ni","History Channel: Civil War","Hisshou Pachinko*Pachi-Slot Kouryaku Series DS Vol. 1: Shinseiki Evangelion - Magokoro o, Kimi ni","0.17525773195876293","0.17525773195876293"
"LinearCombinationMatchingRule","Games_Updated_ID_1169","vgsales_ID_3209","0.19354838709677424",,"Cabal 2","Cabela's Big Game Hunter (2008)","Cabal 2","Cabela's Big Game Hunter (2008)","0.19354838709677424","0.19354838709677424"
"LinearCombinationMatchingRule","Games_Updated_ID_2476","vgsales_ID_8911","0.4",,"Battleship","Battle Stadium D.O.N","Battleship","Battle Stadium D.O.N","0.4","0.4"
"LinearCombinationMatchingRule","Games_Updated_ID_8996","vgsales_ID_1489","0.25",,"The Warriors","The LEGO Movie Videogame","The Warriors","The LEGO Movie Videogame","0.25","0.25"
"LinearCombinationMatchingRule","Games_Updated_ID_10142","vgsales_ID_6273","0.21153846153846156",,"The Day After Tomorrow","The Legend of Zelda: The Minish Cap(weekly JP sales)","The Day After Tomorrow","The Legend of Zelda: The Minish Cap(weekly JP sales)","0.21153846153846156","0.21153846153846156"
"LinearCombinationMatchingRule","Games_Updated_ID_720","vgsales_ID_2580","0.30000000000000004",,"The Town Of Light","The Sims 2: Castaway","The Town Of Light","The Sims 2: Castaway","0.30000000000000004","0.30000000000000004"
"LinearCombinationMatchingRule","Games_Updated_ID_9230","vgsales_ID_12349","0.3392857142857143",,"Star Wars Lightsaber Combat","Star Wars Knights of the Old Republic II: The Sith Lords","Star Wars Lightsaber Combat","Star Wars Knights of the Old Republic II: The Sith Lords","0.3392857142857143","0.3392857142857143"
"LinearCombinationMatchingRule","Games_Updated_ID_8700","vgsales_ID_8795","0.3207547169811321",,"The Lord of the Rings, The Battle for Middle-earth II","The Secret Saturdays: Beasts of the 5th Sun","The Lord of the Rings, The Battle for Middle-earth II","The Secret Saturdays: Beasts of the 5th Sun","0.3207547169811321","0.3207547169811321"
"LinearCombinationMatchingRule","Games_Updated_ID_2437","vgsales_ID_6985","0.14814814814814814",,"Project Zero 2: Wii Edition","Pro Yakyuu Team o Tsukurou!","Project Zero 2: Wii Edition","Pro Yakyuu Team o Tsukurou!","0.14814814814814814","0.14814814814814814"
"LinearCombinationMatchingRule","Games_Updated_ID_14260","vgsales_ID_13045","0.75",,"Street Fighter Alpha","Street Fighter V","Street Fighter Alpha","Street Fighter V","0.75","0.75"
"LinearCombinationMatchingRule","Games_Updated_ID_1790","vgsales_ID_15756","0.4",,"Battlefield 4","Battle Engine Aquila","Battlefield 4","Battle Engine Aquila","0.4","0.4"
"LinearCombinationMatchingRule","Games_Updated_ID_9163","vgsales_ID_11910","0.2692307692307693",,"Jamdat Sports NFL 2006","James Cameron's Dark Angel","Jamdat Sports NFL 2006","James Cameron's Dark Angel","0.2692307692307693","0.2692307692307693"
"LinearCombinationMatchingRule","Games_Updated_ID_8964","vgsales_ID_2406","0.3793103448275862",,"Guitar Hero","Guitar Hero: Warriors of Rock","Guitar Hero","Guitar Hero: Warriors of Rock","0.3793103448275862","0.3793103448275862"
"LinearCombinationMatchingRule","Games_Updated_ID_8007","vgsales_ID_2197","0.25",,"Columns Crown","Colin McRae Rally 04","Columns Crown","Colin McRae Rally 04","0.25","0.25"
"LinearCombinationMatchingRule","Games_Updated_ID_3747","vgsales_ID_5655","0.25",,"Rocket Knight","Rock Band Country Track Pack","Rocket Knight","Rock Band Country Track Pack","0.25","0.25"
"LinearCombinationMatchingRule","Games_Updated_ID_3023","vgsales_ID_128","0.3157894736842105",,"The First Templar","The Legend of Zelda","The First Templar","The Legend of Zelda","0.3157894736842105","0.3157894736842105"
"LinearCombinationMatchingRule","Games_Updated_ID_305","vgsales_ID_979","0.34090909090909094",,"The Walking Dead: The Final Season Episode 4","The Legend of Zelda: The Wind Waker","The Walking Dead: The Final Season Episode 4","The Legend of Zelda: The Wind Waker","0.34090909090909094","0.34090909090909094"
"LinearCombinationMatchingRule","Games_Updated_ID_10113","vgsales_ID_9849","0.140625",,"Crazy Castle","Crash Superpack: Crash Bandicoot 2: N-Tranced / Crash Nitro Kart","Crazy Castle","Crash Superpack: Crash Bandicoot 2: N-Tranced / Crash Nitro Kart","0.140625","0.140625"
"LinearCombinationMatchingRule","Games_Updated_ID_6747","vgsales_ID_7951","0.3125",,"ProStroke Golf - World Tour 2007","Pro Yaky? Spirits 2012","ProStroke Golf - World Tour 2007","Pro Yaky? Spirits 2012","0.3125","0.3125"
"LinearCombinationMatchingRule","Games_Updated_ID_747","vgsales_ID_4760","0.4117647058823529",,"Little Nightmares","Littlest Pet Shop","Little Nightmares","Littlest Pet Shop","0.4117647058823529","0.4117647058823529"
"LinearCombinationMatchingRule","Games_Updated_ID_11581","vgsales_ID_6289","0.38888888888888884",,"Dragon's Lair 3D: Return to the Lair","Dragon Ball GT: Final Bout","Dragon's Lair 3D: Return to the Lair","Dragon Ball GT: Final Bout","0.38888888888888884","0.38888888888888884"
"LinearCombinationMatchingRule","Games_Updated_ID_3467","vgsales_ID_4157","0.20833333333333337",,"The Sims 3","The Godfather (JP sales)","The Sims 3","The Godfather (JP sales)","0.20833333333333337","0.20833333333333337"
"LinearCombinationMatchingRule","Games_Updated_ID_10516","vgsales_ID_12659","0.4",,"Wars and Warriors: Joan of Arc","Warriors: Legends of Troy","Wars and Warriors: Joan of Arc","Warriors: Legends of Troy","0.4","0.4"
"LinearCombinationMatchingRule","Games_Updated_ID_985","vgsales_ID_5951","0.15909090909090906",,"Battleborn","Batman: The Brave and the Bold the Videogame","Battleborn","Batman: The Brave and the Bold the Videogame","0.15909090909090906","0.15909090909090906"
"LinearCombinationMatchingRule","Games_Updated_ID_8726","vgsales_ID_1457","0.3191489361702128",,"Marc Ecko's Getting Up: Contents Under Pressure","Mario & Luigi: Partners in Time","Marc Ecko's Getting Up: Contents Under Pressure","Mario & Luigi: Partners in Time","0.3191489361702128","0.3191489361702128"
"LinearCombinationMatchingRule","Games_Updated_ID_1094","vgsales_ID_506","0.64",,"Call of Duty: Black Ops 3","Call of Duty: Ghosts","Call of Duty: Black Ops 3","Call of Duty: Ghosts","0.64","0.64"
"LinearCombinationMatchingRule","Games_Updated_ID_7168","vgsales_ID_11899","0.25",,"The Movies: Stunts & Effects","The Testament of Sherlock Holmes","The Movies: Stunts & Effects","The Testament of Sherlock Holmes","0.25","0.25"
"LinearCombinationMatchingRule","Games_Updated_ID_7668","vgsales_ID_7436","0.3913043478260869",,"Batman: Chaos in Gotham","Batman Begins","Batman: Chaos in Gotham","Batman Begins","0.3913043478260869","0.3913043478260869"
"LinearCombinationMatchingRule","Games_Updated_ID_9927","vgsales_ID_15591","0.3846153846153846",,"Starsky & Hutch","Starry ? Sky: After Summer","Starsky & Hutch","Starry ? Sky: After Summer","0.3846153846153846","0.3846153846153846"
"LinearCombinationMatchingRule","Games_Updated_ID_932","vgsales_ID_10974","0.18604651162790697",,"The Technomancer","The Secret Saturdays: Beasts of the 5th Sun","The Technomancer","The Secret Saturdays: Beasts of the 5th Sun","0.18604651162790697","0.18604651162790697"
"LinearCombinationMatchingRule","Games_Updated_ID_3208","vgsales_ID_9943","0.26315789473684215",,"The 3rd Birthday","The Lord of the Rings: Aragorn's Quest","The 3rd Birthday","The Lord of the Rings: Aragorn's Quest","0.26315789473684215","0.26315789473684215"
"LinearCombinationMatchingRule","Games_Updated_ID_6767","vgsales_ID_8921","0.24390243902439024",,"The Legend of Spyro: A New Beginning","The Incredible Hulk: Ultimate Destruction","The Legend of Spyro: A New Beginning","The Incredible Hulk: Ultimate Destruction","0.24390243902439024","0.24390243902439024"
"LinearCombinationMatchingRule","Games_Updated_ID_14442","vgsales_ID_15641","0.5",,"Final Fantasy Anthology","Final Fantasy XIV: Heavensward","Final Fantasy Anthology","Final Fantasy XIV: Heavensward","0.5","0.5"
"LinearCombinationMatchingRule","Games_Updated_ID_13248","vgsales_ID_6499","0.25",,"Star Trek: The Next Generation - Birth of the Federation","Star Wars: Bounty Hunter","Star Trek: The Next Generation - Birth of the Federation","Star Wars: Bounty Hunter","0.25","0.25"
"LinearCombinationMatchingRule","Games_Updated_ID_3399","vgsales_ID_14676","0.2093023255813954",,"Harry Potter and the Deathly Hallows Part 1","Harukanaru Toki no Naka de 5: Kazahanaki","Harry Potter and the Deathly Hallows Part 1","Harukanaru Toki no Naka de 5: Kazahanaki","0.2093023255813954","0.2093023255813954"
"LinearCombinationMatchingRule","Games_Updated_ID_2904","vgsales_ID_5389","0.3076923076923077",,"The Gunstringer","The Urbz: Sims in the City","The Gunstringer","The Urbz: Sims in the City","0.3076923076923077","0.3076923076923077"
"LinearCombinationMatchingRule","Games_Updated_ID_3361","vgsales_ID_14400","0.3913043478260869",,"Super Meat Boy","Super Heroine Chronicle","Super Meat Boy","Super Heroine Chronicle","0.3913043478260869","0.3913043478260869"
"LinearCombinationMatchingRule","Games_Updated_ID_2607","vgsales_ID_13270","0.2222222222222222",,"Shin Megami Tensei: Devil Survivor 2","Ship Simulator Extremes","Shin Megami Tensei: Devil Survivor 2","Ship Simulator Extremes","0.2222222222222222","0.2222222222222222"
"LinearCombinationMatchingRule","Games_Updated_ID_488","vgsales_ID_3029","0.2542372881355932",,"The Awesome Adventures Of Captain Spirit - Mind Over Matter","The LEGO Movie Videogame","The Awesome Adventures Of Captain Spirit - Mind Over Matter","The LEGO Movie Videogame","0.2542372881355932","0.2542372881355932"
"LinearCombinationMatchingRule","Games_Updated_ID_4284","vgsales_ID_1039","0.8",,"Madden NFL 10","Madden NFL 2005","Madden NFL 10","Madden NFL 2005","0.8","0.8"
"LinearCombinationMatchingRule","Games_Updated_ID_1859","vgsales_ID_14870","0.18604651162790697",,"Batman: Arkham City - Nightwing Bundle Pack","Battlestations: Pacific","Batman: Arkham City - Nightwing Bundle Pack","Battlestations: Pacific","0.18604651162790697","0.18604651162790697"
"LinearCombinationMatchingRule","Games_Updated_ID_3063","vgsales_ID_5820","0.33333333333333337",,"Lego Pirates of the Caribbean: The Video Game","LEGO Legends of Chima: Laval's Journey","Lego Pirates of the Caribbean: The Video Game","LEGO Legends of Chima: Laval's Journey","0.33333333333333337","0.33333333333333337"
"LinearCombinationMatchingRule","Games_Updated_ID_3773","vgsales_ID_8802","0.29268292682926833",,"Naruto Shippuden: Ultimate Ninja Heroes 3","Naruto: Powerful Shippuden","Naruto Shippuden: Ultimate Ninja Heroes 3","Naruto: Powerful Shippuden","0.29268292682926833","0.29268292682926833"
"LinearCombinationMatchingRule","Games_Updated_ID_11201","vgsales_ID_7103","0.2222222222222222",,"The Hulk","The Raiden Project","The Hulk","The Raiden Project","0.2222222222222222","0.2222222222222222"
"LinearCombinationMatchingRule","Games_Updated_ID_9793","vgsales_ID_895","0.38888888888888884",,"The Lord of the Rings, The Third Age","The Legend of Zelda: Oracle of Ages","The Lord of the Rings, The Third Age","The Legend of Zelda: Oracle of Ages","0.38888888888888884","0.38888888888888884"
"LinearCombinationMatchingRule","Games_Updated_ID_2384","vgsales_ID_3013","0.19999999999999996",,"The Walking Dead: Episode 3 - Long Road Ahead","The Darkness","The Walking Dead: Episode 3 - Long Road Ahead","The Darkness","0.19999999999999996","0.19999999999999996"
"LinearCombinationMatchingRule","Games_Updated_ID_12940","vgsales_ID_7463","0.23529411764705888",,"NHL Powerplay '96","NHL 2003","NHL Powerplay '96","NHL 2003","0.23529411764705888","0.23529411764705888"
"LinearCombinationMatchingRule","Games_Updated_ID_6377","vgsales_ID_2899","0.30000000000000004",,"NBA Street Homecourt","NBA Live 09","NBA Street Homecourt","NBA Live 09","0.30000000000000004","0.30000000000000004"
"LinearCombinationMatchingRule","Games_Updated_ID_12416","vgsales_ID_14392","0.3846153846153846",,"TimeSplitters","Timmy Time","TimeSplitters","Timmy Time","0.3846153846153846","0.3846153846153846"
"LinearCombinationMatchingRule","Games_Updated_ID_8881","vgsales_ID_3793","0.5454545454545454",,"NBA Live 06","NBA 06","NBA Live 06","NBA 06","0.5454545454545454","0.5454545454545454"
"LinearCombinationMatchingRule","Games_Updated_ID_5429","vgsales_ID_5620","0.2647058823529411",,"The Golden Compass","The Settlers 7: Paths to a Kingdom","The Golden Compass","The Settlers 7: Paths to a Kingdom","0.2647058823529411","0.2647058823529411"
"LinearCombinationMatchingRule","Games_Updated_ID_1405","vgsales_ID_232","0.1282051282051282",,"The Crew","The Legend of Zelda: A Link to the Past","The Crew","The Legend of Zelda: A Link to the Past","0.1282051282051282","0.1282051282051282"
"LinearCombinationMatchingRule","Games_Updated_ID_11376","vgsales_ID_2599","0.2857142857142857",,"The Messenger","The Walking Dead: Season One","The Messenger","The Walking Dead: Season One","0.2857142857142857","0.2857142857142857"
"LinearCombinationMatchingRule","Games_Updated_ID_7087","vgsales_ID_13718","0.15000000000000002",,"Outlaw Chopper","Ou to Maou to 7-nin no Himegimitachi: Shin Ousama Monogatari","Outlaw Chopper","Ou to Maou to 7-nin no Himegimitachi: Shin Ousama Monogatari","0.15000000000000002","0.15000000000000002"
"LinearCombinationMatchingRule","Games_Updated_ID_9793","vgsales_ID_3020","0.3055555555555556",,"The Lord of the Rings, The Third Age","The Biggest Loser: Challenge","The Lord of the Rings, The Third Age","The Biggest Loser: Challenge","0.3055555555555556","0.3055555555555556"
"LinearCombinationMatchingRule","Games_Updated_ID_11141","vgsales_ID_7904","0.19444444444444442",,"The Italian Job","The Legend of Spyro: A New Beginning","The Italian Job","The Legend of Spyro: A New Beginning","0.19444444444444442","0.19444444444444442"
"LinearCombinationMatchingRule","Games_Updated_ID_2722","vgsales_ID_13393","0.20454545454545459",,"The Kore Gang","The Berenstain Bears and the Spooky Old Tree","The Kore Gang","The Berenstain Bears and the Spooky Old Tree","0.20454545454545459","0.20454545454545459"
"LinearCombinationMatchingRule","Games_Updated_ID_5753","vgsales_ID_9671","0.5714285714285714",,"NHL 08","NHL 2K7","NHL 08","NHL 2K7","0.5714285714285714","0.5714285714285714"
"LinearCombinationMatchingRule","Games_Updated_ID_9799","vgsales_ID_3029","0.25",,"The Incredibles","The LEGO Movie Videogame","The Incredibles","The LEGO Movie Videogame","0.25","0.25"
"LinearCombinationMatchingRule","Games_Updated_ID_5843","vgsales_ID_2661","0.4",,"Galaga '90","Galaxian","Galaga '90","Galaxian","0.4","0.4"
"LinearCombinationMatchingRule","Games_Updated_ID_4218","vgsales_ID_164","0.2222222222222222",,"Marvel: Ultimate Alliance 2","Mario Kart: Super Circuit","Marvel: Ultimate Alliance 2","Mario Kart: Super Circuit","0.2222222222222222","0.2222222222222222"
"LinearCombinationMatchingRule","Games_Updated_ID_8417","vgsales_ID_16414","0.3421052631578947",,"The Crocodile Hunter: Operation Rescue","The Godfather (JP sales)","The Crocodile Hunter: Operation Rescue","The Godfather (JP sales)","0.3421052631578947","0.3421052631578947"
"LinearCombinationMatchingRule","Games_Updated_ID_13194","vgsales_ID_6187","0.34782608695652173",,"Virtual Snooker","Virtua Fighter 5 Online","Virtual Snooker","Virtua Fighter 5 Online","0.34782608695652173","0.34782608695652173"
"LinearCombinationMatchingRule","Games_Updated_ID_10851","vgsales_ID_955","0.28888888888888886",,"The Lord of the Rings: The Return of the King","The Sims: Hot Date","The Lord of the Rings: The Return of the King","The Sims: Hot Date","0.28888888888888886","0.28888888888888886"
